1,Y,NSE-EQ,30/05/2025,0,25065,G,D,705231.12,Being NPS Alloted as on 30/05/2025,Z3249
2,N,NSE-EQ,30/05/2025,0,15181,G,C,699863.41,Being NPS Obligation as on 30/05/2025,Z3249
3,N,NSE-EQ,30/05/2025,0,30064,G,C,2800,Being Account Opening fees on  NPS as on 30/05/2025,Z3249
4,N,NSE-EQ,30/05/2025,0,30063,G,C,1749.57,Being Commission on  NPS as on 30/05/2025,Z3249
5,N,NSE-EQ,30/05/2025,0,15006,G,C,68.35,Being CGST On Commission & Account Opening fee as on 30/05/2025,Z3249
6,N,NSE-EQ,30/05/2025,0,15007,G,C,68.35,Being SGST On Commission & Account Opening fee as on 30/05/2025,Z3249
7,N,NSE-EQ,30/05/2025,0,15008,G,C,681.44,Being IGST On Commission & Account Opening fee as on 30/05/2025,Z3249
