1,Y,NSE-EQ,31/05/2025,0,25065,G,D,3180.1,Being NPS Alloted as on 27/05/2025,Z3249
2,N,NSE-EQ,31/05/2025,0,15181,G,C,0,Being NPS Obligation as on 27/05/2025,Z3249
3,N,NSE-EQ,31/05/2025,0,30064,G,C,0,Being Account Opening fees on  NPS as on 27/05/2025,Z3249
4,N,NSE-EQ,31/05/2025,0,30063,G,C,0,Being Commission on  NPS as on 27/05/2025,Z3249
5,N,NSE-EQ,31/05/2025,0,15006,G,C,0,Being CGST On Commission & Account Opening fee as on 27/05/2025,Z3249
6,N,NSE-EQ,31/05/2025,0,15007,G,C,0,Being SGST On Commission & Account Opening fee as on 27/05/2025,Z3249
7,N,NSE-EQ,31/05/2025,0,15008,G,C,0,Being IGST On Commission & Account Opening fee as on 27/05/2025,Z3249
